ID,Course ID,Course Title,Course Description,Course Prerequisites,Department,Department ID
188,01:070:358,Introduction to Human Osteology (3),"Intensive introduction to human osteology, bone   biology and growth, and paleopathology. Basis for advanced work in   paleoanthropology, forensic anthropology, bioarchaeology, and osteometry.",Prerequisite: 01:070:102 or equivalent. Corequisite:   01:070:359. Permission of instructor required.,Anthropology,070
189,01:070:359,Human Osteology Laboratory (3),Accompanies 01:070:358. Intensive practical training   in osteology lab identification and analysis techniques.,Prerequisite: 01:070:102 or equivalent. Corequisite:   01:070:358. Permission of instructor required.,Anthropology,070
190,01:070:360,Families (3),"Traditional family types and organization studied   cross-culturally. Modern western family and alternatives: utopian   communities, ""intentional"" communities.",Prerequisite: 01:070:101.,Anthropology,070
191,01:070:361,Hunters and Gatherers (3),"Consideration of data from aboriginal Australia, the   Southern African bushmen, and elsewhere, in   light of social theory, including gender   studies.",Prerequisite: 01:070:101 or permission of instructor.,Anthropology,070
192,01:070:363,"Race, Class, Gender, and Schooling   (3)","Examines racial and gender differences in adolescents' school
performance. Structural, historical, and cultural foci. Ethnographic
and autobiographical cases of black students and other students of
color.",Prerequisite: 01:070:101 or permission of instructor.   Credit not given for both this course and either 01:014:363 or 01:988:  363.,Anthropology,070
193,01:070:364,Sex Roles and Social Structure (3),"Sexual differences in primates; implications for   social, economic, and political relationships in contemporary society.   Cross- cultural comparison. Adaptive and maladaptive features of    sociosexual patterns.",Prerequisite: 01:070:102 or permission of instructor.,Anthropology,070
194,01:070:366,Anthropology of Old Age (3),Cross-cultural approaches to aging and the aged.   Sex-role differences between aged men and women in various societies.,Prerequisite: 01:070:101.,Anthropology,070
195,01:070:368,Anthropology of Mass Media (3),"Mass media and culture. The impact of mass media on   the production and consumption of cultural identities. Inquiry   into representations of gender, sexuality, the body, ethnicity, race,    and nationhood in mass media discourse. The mass media in a   postcolonial, global, and transnational context.",Pre- or corequisite: 01:070:101 or permission of   instructor.,Anthropology,070
196,01:070:370,Folklore and Ideology (3),"Folklore and expressive culture; the political and   ideological importance of narrative traditions. Interpretations of folklore   with reference to gender, ethnicity, the family, and the state. Folklore as   an agent of social transformation: socialism, nationalism, fascism.",Prerequisite: 01:070:101.,Anthropology,070
197,01:070:371,The Politics of Culture (3),"Politics of cultural processes. Race, gender,   ethnicity, and sexuality in representations. Theories of cultural   production, domination, distribution, and consumption. Resistance and   nonmainstream culture; ethnographic examples of ideology, economy, and   global cultural flows.",Prerequisite: 01:070:101.,Anthropology,070
198,01:070:372,Anthropology of the Body (3),"Body in history and society. Comparative approaches to   cultural construction of bodies. Impact of   gender, sexuality, ethno-national, racial, and   class differences on body practices. Formation of normative discourses on body in medical science, consumer culture, mass media.",Prerequisite: 01:070:101. Recommended: an additional   course in cultural anthropology.,Anthropology,070
199,01:070:374,Localities and Global Systems (3),"Interaction of transnational and local processes   through case studies and theory. Political economy, world systems, and   cultural imperialism. Global culture and media. Intercultural   representation and stereotyping. Diaspora,   transnational movements, and nation-state.",Prerequisite: 01:070:101. Recommended: an additional   course in cultural anthropology.,Anthropology,070
200,01:070:375,Jewish Immigrant Experience (3),"Comparative study of modern Jewish immigrant   experience, focusing on European and Middle Eastern communities   resettled in America, Israel, and Europe.",Credit not given for both this course and 01:506:375   or 01:563:375.,Anthropology,070
201,01:070:376,Power and Difference (3),"Emergent theories of inequality. Social constructions   of difference. Topics challenging conventional notions of cultural   anthropology-identity, representation, discrimination, exclusion,   marginalization, contestation, resistance.",Prerequisite: 01:070:101. Recommended: two additional   courses in cultural anthropology. Intended for majors.,Anthropology,070
202,01:070:378,The Anthropology of Gender (3),"Gender as an analytic category; exchange, production,   reproduction, binarism, representation.   Intersections of gender with class, race, and ethnicity. Theoretical and   ethnographic readings.",Prerequisite: 01:070:101 or permission of instructor.   Credit not given for both this course and 01:988:378.,Anthropology,070
203,01:070:379,Gender and Power in Africa (3),"Experiences and expressions of gender in historical   and contemporary Africa emphasizing issues of diversity and commonality,   modalities of power, and articulation with other forms of difference, such   as ethnicity, class, and nationality.",Credit not given for both this course and 01:988:379.,Anthropology,070
204,01:070:380,"Culture, Memory, History (3)","Anthropological approaches to history and memory.   Theory, method; comparative study of remembering, forgetting,   commemorating, narrating, ritualizing, structuring time. Early,    contemporary scholarship; political economy, identity, authority,   representation in shaping cultural memory, historical constructions.",Prerequisite: 01:070:101 or course in sociology or   history approved by instructor.,Anthropology,070
205,01:070:389,Ethnography of Gender in South Asia   (3),"An explanation of gendered practices in South Asia.   Ethnographies from Hindu, Buddhist, and Muslim communities explore the   various aspects of gender in particular South Asian contexts.",Credit not given for both this course and 01:988:389.,Anthropology,070
206,01:070:390,Plio-Pleistocene Hominid Anatomy (3),"Human fossil record during Plio-Pleistocene; taxonomy,   phylogenetics, and functional morphology. Origins of Hominidae, diversity   in Australopithecus and Paranthropus, rise of Homo and of Homo sapiens.   Castes and published reports; methods of inference.",Prerequisite: 01:070:102.,Anthropology,070
207,01:070:391,Lithic Analysis in Archaeology (3),"Archaeological study of how stone tools were made and   used. Consideration of manufacturing technology, use and wear,    experimental replication, and their implications for   archaeological interpretation.",Prerequisite: 01:070:105.,Anthropology,070
208,01:070:392,Faunal Analysis in Archaeology (3),"Identification of animal bones, teeth, and other   faunal remains in archaeological contexts. Quantifying number of   individuals and skeletal elements; butchery techniques and bone   modification and their implications for archaeological interpretation.",Prerequisite: 01:070:105.,Anthropology,070
209,01:070:393,Cultural Resource Management (3),"Legal, administrative, executive, and practical   aspects of the theory and practice of cultural resource management, with   emphasis on archaeological resources. One field trip.",Prerequisite: 01:070:105.,Anthropology,070
210,01:070:394,Microstratigraphic Analysis in   Archaeology (3),"Field and laboratory studies of geological context in   archaeological sites. Data collection and   sampling, sediment analysis, and reporting. Interpretation   of depositional and postdepositional features.",Recommended: 01:460:340 (may be concurrently   enrolled). Credit not given for both this course and 01:460:394.,Anthropology,070
211,01:070:395,Quantification of Archaeological Data   (3),"Data analysis, coding schemes, data management, and   the application of statistical techniques to problems in archaeology.   Emphasis on creating, maintaining, and using computer files of   archaeological data.",Prerequisite: 01:070:105.,Anthropology,070
212,01:070:401,Theories in Cultural Anthropology (3),Analysis and comparison of the major contemporary   theoretical approaches in cultural anthropology.,Prerequisite: 6 credits in anthropology or permission   of instructor.,Anthropology,070
213,01:070:402,Theories in Physical Anthropology (3),Intensive study of major figures in physical   anthropological thought. Origins and spread of new ideas; methods of   study of humans and nonhuman primates.,Prerequisite: 01:070:102 or permission of instructor.,Anthropology,070
214,01:070:403,Advanced Seminar in North   American Indians (3),Each student conducts research on specific topics in   North American Indians.,"Prerequisite: Two courses from 01:070:230, 231, 315,   or related courses in other departments approved by instructor; or   permission of instructor.",Anthropology,070
215,01:070:404,Advanced Seminar in Archaeology (3),Selected topics and problems in archaeology.,Prerequisite: 01:070:105. Open only to juniors and   seniors.,Anthropology,070
216,01:070:405,Perspectives on Latino Ethnic   Consciousness (3),Contemporary understandings about formation of Latino   ethnic consciousness in the United States. Theoretical and critical   perspectives informing social issues relevant to Latinos.,Credit not given for both this course and 01:836:405.,Anthropology,070
217,01:070:410,Explanation in Anthropology (3),"Analysis of anthropologists' explanations, with consideration of such
topics as the explanatory use of generalizations, models, narratives,
culture-specific categories, and causal, functionalist, and
essentialist claims.",Prerequisite: 01:070:101 or permission of instructor.,Anthropology,070
218,01:070:412,Topics in African Prehistory and   Paleoanthropology (3),"Focused consideration of current research and   explanatory theory, on topics ranging from hominid origins to Holocene   adaptations in Africa.",Prerequisite: 01:070:326 or 327 or permission of   instructor.,Anthropology,070
219,01:070:414,Topics in European Prehistory and   Paleoanthropology (3),"Focused consideration of current research and   explanatory theory, on topics ranging from initial human colonization of   Europe to Holocene adaptations in Europe.",Prerequisite: 01:070:326 or 327 or permission of   instructor.,Anthropology,070
220,01:070:420,Evolutionary Genetics: Humans and   Other Primates (3),"Analysis of molecular evolution of human and primate   genomes, genetic and phenotypic evolution, the genetic basis of being   human, and primate phylogeny.",Prerequisites: 01:447:380 and 01:070:102 or 212 or   permission of instructor. Credit not given for both this course and 01:447:  420.,Anthropology,070
221,01:070:426,South African Archaeology (3),"Archaeology, ecology, and historical archaeology of   South Africa. Covers two million years, early hominids to colonial contact.",Prerequisites: 01:070:102 and 105 or permission of   instructor.,Anthropology,070
222,01:070:486,"Gender, Development, Environment:   Policies, Politics, Perspectives (3)","Using ethnography and gender as a category of   analysis, examines the experiences and implications of transnational   development and environmental policies in specific localities.","Prerequisite: 01:988:101, 201, 202, 235, or permission   of instructor. Credit not given for both this course and 01:988:486.",Anthropology,070
223,"01:070:495,496","Independent Study in Anthropology   (BA,BA)",Supervised study or research on selected   anthropological topics.,Prerequisite: Permission of instructor.,Anthropology,070
224,"01:070:497,498","Honors in Anthropology (3,3)","Two-term supervised project, usually resulting in a   thesis, for qualified seniors.",Prerequisites: Senior standing and acceptance into   departmental honors program.,Anthropology,070
225,"01:082:105,106","Introduction to Art History (3,3)","Survey of the major monuments and trends in the   history of painting, sculpture, and architecture.","Lec. 2 hrs., rec. 1 hr.",Art History,082
226,01:082:111,Honors Seminar I (1),Discussions of assigned readings or further   investigation of themes treated in lecture.,Corequisite: 01:082:105. Enrollment in college honors   or special permission by department required.,Art History,082
227,01:082:112,Honors Seminar II (1),Discussions of assigned readings or further   investigation of themes treated in lecture.,"Corequisite: 01:082:106. Enrollment in college honors   or special permission by department required,",Art History,082
228,01:082:250,"Introduction to Oceanic, African, and    Pre-Columbian Art (3)","Basic concepts in the arts of pre-Columbian   Mesoamerica, Africa, and Oceania: time, natural landscape and architecture,   and the ritual functions of art.",,Art History,082
229,01:082:251,Survey of Russian Art (3),Introduction to the art of Russia covering the 10th   century through the 20th century.,,Art History,082
230,01:082:252,East Asian Art (3),"Discussion of major works (painting, sculpture, and   architecture) of China and Japan. Stress on techniques and styles radically   different from those of Western art.",,Art History,082
231,01:082:276,Great Works of Modern Architecture   (3),"Great monuments of architecture in Europe and America   from the late 17th century to the present; emphasis on building types,   ideas, and the language of architecture.",For students with little or no background in art   history or architecture.,Art History,082
232,"01:082:291,292,293,294","Topics in Art History   (1.5,1.5,1.5,1.5)",Such topics as erotic art; symbolism; landscape   painting from the 15th through the 19th century; the frontier in American art.,"Prerequisites: 01:082:105,106 or permission of   instructor.",Art History,082
233,01:082:300,History of Modern Crafts and Design   (3),"Crafts from the mid-19th century to the present, with   particular attention to major developments such as art nouveau, art deco,   and functionalism. Developments in England, France, Germany, and the United   States.",Prerequisite: 01:082:106 or permission of instructor.,Art History,082
234,01:082:301,Ancient Architecture (3),"Survey of the architecture of ancient civilizations,   emphasizing development of monumental architecture in Egypt, Mesopotamia,   Greece, and Rome. Development of classical orders and principles of design   are stressed.","Prerequisites: 01:082:105,106 or permission of   instructor.",Art History,082
235,01:082:302,Introduction to Contemporary Art (3),Developments in painting and sculpture since 1950.   Classes include field trips to galleries and museums in New York City.,"Prerequisites: 01:082:105,106 or permission of   instructor.",Art History,082
236,01:082:303,Art of Egypt and the Ancient Near   East (3),"Introductory survey of the architecture, painting, and   sculpture of the ancient civilizations of the Nile Valley, Asia Minor, and   Persia. One field trip.",Not open to students who have taken specialized   courses in this area.,Art History,082
237,01:082:304,Architect and Society in England (3),"Architecture and the development of the profession in   England from the Renaissance through the 18th century, emphasizing the   diffusion of classical tradition.","Prerequisites: 01:082:105,106 or permission of   instructor.",Art History,082
238,01:082:305,Women and Art (3),Selected topics on women as subjects of art and/or   makers of art. Several field trips.,"Prerequisites: 01:082:105,106 or permission of   instructor.",Art History,082
239,01:082:306,Roman Art (3),Roman art from its Hellenic and native Italic origins   to the end of the pagan tradition.,"Prerequisites: 01:082:105,106 or permission of   instructor.",Art History,082
240,01:082:307,Painting of the 19th and 20th   Centuries (3),"Painting in modern times: impressionism, cubism,   fauvism, expressionism, surrealism, and others.","Prerequisites: 01:082:105,106 or permission of   instructor.",Art History,082
241,01:082:308,The Age of Giotto (3),"Italian art and architecture from ca. 1250 to ca.   1400, with an emphasis on the stylistic and thematic innovations of Giotto   and his successors and the developments of the schools of Florence,   Siena, and Venice.","Prerequisites: 01:082:105,106 or permission of   instructor.",Art History,082
242,01:082:309,Masaccio and His Contemporaries (3),"Italian art and architecture of the 15th century,   focusing on such masters as Masaccio, Donatello, Botticelli, and Alberti;   the triumph of naturalism; Renaissance humanism and art theory.","Prerequisites: 01:082:105,106 or permission of   instructor.",Art History,082
243,01:082:310,The High Renaissance in Italy (3),"Sixteenth-century art and architecture, emphasizing   the achievements of the great central Italian masters: Leonardo da Vinci, Raphael, and Michelangelo; the artistic cult   of personality and rivalry with classical antiquity; the crisis of   Mannerism.","Prerequisites: 01:082:105,106 or permission of   instructor.",Art History,082
244,01:082:311,Egyptian Art (3),"Survey of art and architecture in ancient Egypt from   pre-Dynastic to Ptolemaic times. Extensive examination of the culture of   Egypt-burial customs, religion, kingship, etc. Related discussions   centered on the legacy of Egypt in Western art and popular culture.","Prerequisites: 01:082:105,106 or permission of   instructor.",Art History,082
245,01:082:312,Byzantine Art (3),"Art and architecture of the Eastern Roman Empire, 3rd   through the 15th centuries. Emphasis on sources of Byzantine style and   iconography and on the historical context of Byzantine art.","Prerequisites: 01:082:105,106 or permission of   instructor.",Art History,082
246,01:082:313,The Renaissance in Northern Europe   (3),"Religious and secular art in Germany, the Netherlands,   and France during the 16th century; painting, sculpture, and prints; impact   of reformation and humanism.","Prerequisites: 01:082:105,106 or permission of   instructor.",Art History,082
247,01:082:314,Etruscan Art (3),"Study of the transition between Greek and Roman   worlds. Consideration of architecture, painted decoration, sculpture,   and minor arts, tombs, and funeral practices in the ancient world.","Prerequisites: 01:082:105,106 or permission of   instructor.",Art History,082
248,01:082:315,Seventeenth-Century Art in Europe (3),"Baroque painting, sculpture, and architecture,   emphasizing thematic and stylistic characteristics of the period in   works of major artists: Caravaggio, Bernini, Velázquez, Poussin,   Rubens, and Rembrandt.","Prerequisites: 01:082:105,106 or permission of   instructor.",Art History,082
249,01:082:316,Anglo-Saxon Art (3),Art and architecture of Anglo-Saxon England from   Sutton Hoo through the Bayeux Tapestry.,"Prerequisites: 01:082:105,106 or permission of   instructor.",Art History,082
250,01:082:317,Ancient Painting (3),"Development of Greek, Etruscan, and Roman painting   from the 8th century b.c. through the Roman Empire.",Prerequisite: 01:082:105.,Art History,082
251,01:082:318,Myth and Legend in Art (3),"Mythology and the artist's response to the myths and legends of his or
her civilization, from antiquity through the Middle Ages. Continuity
and transformation of central themes.",,Art History,082
252,01:082:319,Celtic and Early Irish Art (3),"Celtic, early Irish, and Anglo-Saxon art ca. 800 b.c. to a.d. 800. Emphasis on sculpture,   metalwork, and enamel, and manuscript illumination.","Prerequisites: 01:082:105,106 or permission of   instructor.",Art History,082
253,01:082:320,Islamic Art and Architecture (3),"Intensive overview of the art and architecture of the   Islamic world, from Spain to India.","Pre- or corequisites: 01:082:105,106. Credit not given   for both this course and 01:667:320 or 01:685:320.",Art History,082
254,01:082:321,Art of Early China (3),"Concentration on archaeological finds: pottery, jade,   bronze, precious metals, lacquer from the Neolithic through the   early great dynasties (5000 b.c. to a.d. 600).",Prerequisite: 01:082:252 or permission of instructor.,Art History,082
255,01:082:322,Survey of Japanese Art (3),"The many facets of Japanese art (5000 b.c. to modern   times). Study of sculpture and painting, temples, and decorative arts.",Prerequisite: 01:082:252 or permission of instructor.,Art History,082
256,01:082:323,Buddhist Art of Asia (3),Buddhist iconography and art as it spread from India   to East Asian countries between 200 b.c. and a.d. 1250.,Prerequisite: 01:082:252 or permission of instructor.,Art History,082
257,01:082:324,Japanese Painting (3),Religious and secular painting from 700 to 1800.   Secular paintings as decorations reflecting   famous literary themes and sensitivity to nature.,Prerequisite: 01:082:252 or permission of instructor.,Art History,082
258,01:082:325,Chinese Painting (3),"Special techniques, special link to calligraphy,   format, subject matter, aesthetic principles, and symbolism governing   artistic process, from 400 to 1600.",Prerequisite: 01:082:252 or permission of instructor.,Art History,082
259,01:082:326,Chinese Sculpture (3),"Major religious (Buddhist and Taoist) and secular   sculpture of China of the three great dynasties, Han, Tang, and Song    (from common era to 1250).",Prerequisite: 01:082:252 or permission of instructor.,Art History,082
260,01:082:331,Introduction to African and Oceanic   Art (3),Emphasis on the sculptural traditions of black Africa;   the art of Melanesia and Polynesia; stylistic analysis; art in relation to   total culture; the impact of these arts on 20th-century Western   developments. One field trip.,Prerequisite: 01:082:250 or permission of instructor.,Art History,082
261,01:082:332,African-American Art (3),"Art of peoples of African descent in the United States   during the 19th and 20th centuries. Emphasis on artistic, political, and   philosophical issues.",,Art History,082
262,01:082:333,Pre-Columbian Art (3),"Art and archaeology of pre-Columbian North and South   America; major contributions of the Olmec, Mayan, and Aztec peoples.",Prerequisite: 01:082:250 or permission of instructor.,Art History,082
263,01:082:334,Blacks in Western Art (3),Examination of representations and presentations of   peoples of African descent by late-18th- and 19th-century European and   Euro-American artists.,,Art History,082
264,01:082:335,Painting in England from Holbein to   Turner (3),Survey of major painters and artistic movements in   England from ca. 1530 to 1860.,"Prerequisites: 01:082:105,106 or permission of   instructor.",Art History,082
265,01:082:341,Venice (3),"City and art of Venice considered in context of   social/cultural history as reflected in masters such as Bellini,   Titian, Palladio; their interpretation of favored Venetian themes:   sensuality, religion, politics.","Prerequisites: 01:082:105,106 or permission of   instructor.",Art History,082
266,01:082:342,Early Greek Art (3),Survey of art in the Aegean from the early Bronze Age   through the Archaic period (ca. 2500-500 b.c.).,"Prerequisites: 01:082:105,106 or permission of   instructor.",Art History,082
267,01:082:343,Later Greek Art (3),Survey of classical and Hellenistic Greek art.,"Prerequisites: 01:082:105,106 or permission of   instructor.",Art History,082
268,01:082:344,French Renaissance Art (3),French art in the Renaissance from Francis I to Henry   IV; the arts at court and the growth of Paris.,Prerequisite: 01:082:106 or permission of instructor.,Art History,082
269,01:082:345,Field Study (6),"Provides supervised participation in fieldwork.   Involves participation and instruction in techniques of archaeological   excavation and in analysis, evaluation, and conservation of objects.",Prerequisite: Permission of instructor. Offered only   in summer (eight weeks).,Art History,082
270,01:082:346,French 17th-Century Art (3),The triumph of French art from Henry IV to Louis XIV;   the emergence of French classicism and the creation of Versailles.,Prerequisite: 01:082:106 or permission of instructor.,Art History,082
271,01:082:347,Early Northern European Painting (3),"Development of 15th-century easel painting in France,   the Netherlands, and Germany; relationship of painting to decorative arts;   symbolism, realism, invention from Van Eyck to Bosch.","Prerequisites: 01:082:105,106 or permission of   instructor.",Art History,082
272,01:082:348,Northern European Painting of the   17th Century (3),"Styles, themes, and historical context of painting in   17th-century Northern Europe, with emphasis on the Netherlands. Artists   include Rubens, Van Dyck, Rembrandt, and Vermeer.","Prerequisites: 01:082:105,106 or permission of   instructor.",Art History,082
273,01:082:349,Rubens and the Baroque in Flanders   (3),"Rubens' career and oeuvre, emphasizing his impact on courtly and
Counter-Reformation art of the 17th century; Van Dyck, Jordaens,
Brouwer, Teniers; architecture, sculpture, graphics.","Prerequisites: 01:082:105,106 or permission of   instructor.",Art History,082
274,01:082:350,Rembrandt and His Followers (3),"Rembrandt's paintings and graphics, emphasizing   his development as an artist and his impact on Netherlandish traditions.","Prerequisites: 01:082:105,106 or permission of   instructor.",Art History,082
275,01:082:352,Art of the 18th Century (3),The creation and subsequent dissolution of the rococo   style under the impact of the neoclassical mode and the French Revolution.,"Prerequisites: 01:082:105,106 or permission of   instructor.",Art History,082
