ID,Course ID,Course Title,Course Description,Course Prerequisites,Department,Department ID
432,01:220:349,Economics of Transition (3),Economic analysis of the policies and performance of   the transition economies of the former Soviet Union and Eastern Europe.,"Prerequisites: 01:220:203, 204, 322.",Economics,220
433,01:220:356,Economics of Latin America (3),Survey of Latin American economic patterns and   problems; specific studies of selected national economies and their   relation to the world economy.,"Prerequisites: 01:220:203, 204, 322. Credit not given   for both 01:220:346 and 356.",Economics,220
434,01:220:357,Economics of India (3),Examination of Indian economy from independence until   today; tools for analyzing Indian economy and   other developing economies.,"Prerequisites: 01:220:102, 103.",Economics,220
435,01:220:358,Economics of Japan (3),Study of the modernization of the first non-Western   industrialized economy.,"Prerequisites: 01:220:203, 204, 322.",Economics,220
436,01:220:359,Economics of Asia (3),"Major Asian economies (excluding Japan) in four units: Asia's newly
industrializing economies (Korea, Taiwan, and Hong Kong); Southeast
Asia; China and Central Asia; India and South Asia. Focus on Green
Revolution in Asia, Asian industrialization and structural change, and
the changing pattern of comparative advantage in United States-Asia
economic relations.","Prerequisites: 01:220:102, 103.",Economics,220
437,01:220:360,Public Economics (3),Rationale for the public sector; public expenditure   theory; economics of political process;   expenditure structure and growth; incidence and incentives of specific   taxes; fiscal incidence; stabilization.,"Prerequisites: 01:220:203, 322.",Economics,220
438,01:220:362,Comparative Economic Systems (3),Comparative analysis of differing economic systems   with emphasis on plan/market comparisons and the nature of transitions in   formerly planned economies.,"Prerequisites: 01:220:102, 103, or permission of   instructor.",Economics,220
439,01:220:363,Economics of Taxation (3),Structure of U.S. tax system. Effects on the   allocation of resources and economic growth; distribution of the burden of   taxation across income groups.,"Prerequisites: 01:220:203, 322.",Economics,220
440,01:220:369,State and Local Public Finance (3),Evolution of federalism; analysis of expenditure and   revenue decisions and intergovernmental grants; discussion of   stabilizing and distributional aspects of state-local finances; specific   state-local fiscal problems.,"Prerequisites: 01:220:203, 322.",Economics,220
441,01:220:370,Economic Growth (3),"Theories, experience, and measurement of quantitative   changes in output, employment, price levels, and other economic aggregates    in modern developed countries.","Prerequisites: 01:220:203, 204, 322.",Economics,220
442,01:220:375,Women and the Economy (3),"Description and analysis of women's economic status. Theories of
discrimination against women in the labor market, including
neoclassical, institutional, and Marxian. Women's work in the home
analyzed from three perspectives: household utility maximization,
patriarchy, and a sex-gender system. Application of theories to case
studies.","Prerequisites: 01:220:203, 322.",Economics,220
443,01:220:377,Economics of Population (3),Theoretical and empirical study of the interrelations   between population change and economic change in developed as   well as less developed countries.,"Prerequisites: 01:220:102, 103.",Economics,220
444,01:220:378,Economies of the USSR and Russia (3),Analysis of the former Soviet economic system and   attempted reforms through Perestroika: the transition to markets in the   post-Soviet era in Russia and the Commonwealth of Independent States.,"Prerequisites: 01:220:203, 204, 322.",Economics,220
445,01:220:379,Marxian Economics (3),"The method of dialectical materialism; economic interpretation of
history; emphasis on Marx's analysis of the laws of capitalist
development (value and price, surplus value, accumulation, crisis,
etc.); transition from ""primitive"" to ""full"" communism.","Prerequisites: 01:220:102, 103.",Economics,220
446,01:220:386,Operations Research I (3),"Application of quantitative methods to production   management including decision theory, game theory, deterministic inventory   theory, queuing, and linear programming.","Prerequisites: 01:220:203, 322.",Economics,220
447,01:220:388,"Government Protection of Consumers,   Employees, and Investors (3)","Market failure; consumer protection from hazardous   products, false advertising, and deceptive sales practices; regulation of   workplace safety; protection of investor and pension funds.","Prerequisites: 01:220:203, 322.",Economics,220
448,01:220:389,Public Policies toward Business (3),"Analysis of major policies affecting competition.   Topics include antitrust, traditional public-utility regulation, and   newer regulatory alternatives.","Prerequisites: 01:220:102, 103.",Economics,220
449,01:220:393,Financial Economics (3),"Analysis of financial decision making; capital   budgeting, capital structure, economic forecasting.","Prerequisites: 01:220:203, 322.",Economics,220
450,01:220:394,Economics of Capital Markets (3),Capital markets uncertainty; asset valuation; return   on assets; determinants of relative yields. Theories of stock and bond   market activity. Innovations in financial instruments.,"Prerequisites: 01:220:204, 322, 393.",Economics,220
451,01:220:395,Law and Economics (3),"Economic rationale and consequences of legal rules.   Contracts, compensation, property rights, liability rules, crime, safety, monopoly, discrimination, health care, pollution, public   interest law.","Prerequisites: 01:220:102, 103.",Economics,220
452,01:220:396,"Corporations, Bankruptcies, and   Takeovers (3)","Origin and nature of corporations, corporate   bankruptcy including liquidation and reorganization, mergers and   acquisitions, takeover disputes.","Prerequisites: 01:220:102, 103, or 200. Credit not   given for both this course and 01:220:309.",Economics,220
453,01:220:397,Internship in Economics (1),Supervised internship in economics-related position.   Approval of the director of undergraduate studies and term paper required.,"Prerequisites: 01:220:102, 103, or 200. Each student   is limited to one internship in economics. Students are responsible for   finding internships. Majors only. Graded Pass/No Credit.",Economics,220
454,"01:220:398,399","Independent Study in Economics   (3,3)",Independent research supervised by a faculty member.,"Prerequisites: 01:220:102, 103, or 200. By permission   of instructor and department. Maximum of two independent study courses in   economics allowed.",Economics,220
455,01:220:401,Advanced Econometrics (3),"Applications of econometric methods in economic   analysis. Demand and cost analysis, macro models, income distribution,   labor participation.","Prerequisites: 01:220:203, 204; 322 or 326.",Economics,220
456,01:220:405,Economics of Uncertainty (3),"Measurement of risk, attitudes toward risk, decision   making under uncertainty, Bayesian decision theory, applications to   asset markets.",Prerequisites: 01:220:203; 01:960:211 or 285; 01:640:  136 or 152.,Economics,220
457,01:220:406,Game Theory and Economics (3),"Expected utility theory, zero and nonzero sum games,   cooperative and noncooperative games, bargaining models, supergames,    oligopoly, core market games, strategy-proof systems.",Prerequisites: 01:220:203; 01:960:211 or 285; 01:640:  136 or 152. Credit not given for both this course and 436 or for both this   course and 01:640:355.,Economics,220
458,01:220:407,Economics of Information (3),"Private and asymmetric information, moral hazard with   optimal contracts, adverse selection with applications to signaling and   screening, and incentive mechanisms such as auctions and tournaments.",Prerequisites: 01:220:203 and 01:960:211 or 285; 01:  640:136 or 152.,Economics,220
459,01:220:409,Mathematical Economics (3),"Mathematical approach to topics in theoretical   economics: linear models, nonlinear programming, comparative statics,   consumer behavior, theory of the firm, market structure, welfare theory.","Prerequisites: 01:220:203, 204, 322.",Economics,220
460,01:220:410,Operations Research II (3),"Development and use of advanced techniques of   production management, including advanced topics in linear programming,   PERT, nonlinear programming, dynamic programming, stochastic inventory   theory, Markov analysis and simulation.","Prerequisites: 01:220:203, 322; 01:640:136 or 152.",Economics,220
461,01:220:412,Monetary Theory and Policy (3),"Role of money and the monetary system in determining   income, employment, and price level; techniques of monetary policy;   relation of monetary and fiscal policy; international policies.","Prerequisites: 01:220:204, 322.",Economics,220
462,01:220:415,Portfolio Theory (3),Selection of a financial portfolio under conditions of   uncertainty. Treatment of risk. Case histories of investment fund   performance.,Prerequisite: 01:220:394.,Economics,220
463,01:220:416,Government Policies for Full   Employment and Growth (3),"Alternative government policies to ensure fulfillment   of the national goals of full employment, price stability, satisfactory   growth, and balanced international payments.","Prerequisites: 01:220:204, 322.",Economics,220
464,01:220:419,Managerial Economics (3),"Application of contemporary economic theory to   managerial decisions and to public policy affecting business. Incremental   analysis, applications of linear programming to cost minimization and   product mix, demand forecasting, pricing problems, and issues of public   policy.","Prerequisites: 01:220:203, 322.",Economics,220
465,01:220:421,Economic Forecasting (3),Application of forecasting to private- and   public-sector decisions. Emphasis on time-series models with microeconomic   and macroeconomic applications and computer exercises.,"Prerequisites: 01:220:203, 204, 322.",Economics,220
466,01:220:430,Topics in Advanced Economic Theory   (3),"Economic dynamics; variational methods with   applications; economics under uncertainty; imperfect information and   market structure; social choice, design of incentive-compatible systems;   general equilibrium.","Prerequisites: 01:220:203, 204, 322.",Economics,220
467,01:220:433,Advanced Topics in International   Economics (3),"Topics may include strategic trade, trade and economic   growth, the political economy of trade policy, exchange rate   determination, international coordination of macroeconomic policy,   empirical issues in international economics, and foreign direct investment.","Prerequisites: 01:220:203, 204, 322.",Economics,220
468,01:220:471,Economics of Regulation (3),"Applied topics in rate-of-return regulation. Emphasis   on underlying financial, accounting, and   pricing issues in selected  utilities   industries.","Prerequisites: 01:220:203, 322.",Economics,220
469,"01:220:490,491","Advanced Independent Study and   Research (3,3)",Specialized research supervised by a faculty member.,"Prerequisites: 01:220:203, 204, 322. Open to juniors   and seniors by permission of instructor and department. Maximum of two   independent study courses in economics allowed.",Economics,220
470,01:220:493,Senior Honors Seminar I (3),Selected topics in economics.,"Prerequisites: 01:220:203, 204, 322. Corequisite: 02:  220:401.",Economics,220
471,01:220:494,Senior Honors Seminar II (3),Selected topics in economics.,Prerequisite: 01:220:493.,Economics,220
472,"01:220:495,496","Seminar in Economics (3,3)","Readings, analysis, and discussion of topics announced   in advance each term.",Open to juniors and seniors by permission of   department.,Economics,220
473,01:506:105,Honors Colloquium (3),Study of a contemporary social issue from the   perspective of the discipline of history. Specific title available at time   of registration through the Faculty of Arts and Sciences honors programs.,By permission of the department. Open to students in   college honors.,History,506
474,01:506:110,Age of European Global Expansion (3),"Traces the rise of Europe to global dominance beginning with early
explorers and empire builders, and focusing on Europe's impact on
Africa, Asia, and the Americas.",,History,506
475,01:506:112,Patterns in Civilization: Love (3),"Love and its literary expression in Japan and Europe   since the Middle Ages. Comparative analysis of culture and society,   political and economic transformations, religion.",,History,506
476,01:506:113,Patterns in Civilization: Death (3),"Individual and societal responses to death in Japan,   Europe, and the United States. Comparative analysis of culture and society,   political and economic transformation, religion.",,History,506
477,01:506:114,"World Civilizations: Europe, Africa,   and America (3)","Family, economy, government, and religion in major   civilizations of West Africa, Europe, and North America. Interaction of   these three geographical areas through the slave trade, colonialism, and   the movement of ideas and culture.",,History,506
478,01:506:201,Twentieth-Century Global History to   1945 (3),"Emphasis on themes in political-military and   social-cultural history worldwide, including imperialism, origins and   impact of two world wars, revolutions, fascism, Nazism, race and gender   issues.",Credit not given for both this course and 01:506:111.,History,506
479,01:506:202,Twentieth-Century Global History from   1945 (3),"Focus on critical themes from Hiroshima to September   11, 2001, including the atomic age, superpower rivalries, decolonization,   population growth and development, globalization, environmental   degradation, and terrorism.",,History,506
480,01:506:203,Histories of the Pacific (3),Survey of Pacific island peoples and cultures from   early navigators and settlers to the colonial and postcolonial eras of the   19th and 20th centuries.,,History,506
481,01:506:205,Paris/Tokyo: 1700-Present (3),"Comparative study of French and Japanese culture from   1700 to the present, drawing on literary and visual representations   from both traditions.",,History,506
482,01:506:211,Women in Europe and the Americas   until 1800 (3),Survey of women's roles in Western society and   culture-covering Europe and the New World up to about 1800.,Credit not given for both this course and 01:988:211.,History,506
483,01:506:212,Women in Europe and the United States   since 1800 (3),Survey of women's roles in Western society and   culture covering the 19th and 20th centuries.,Credit not given for both this course and 01:988:212.,History,506
484,01:506:221,History of Exploration (3),"Exploring expeditions from Columbus to the moon   flights. Experiences of explorers; political, economic, and cultural   motives for exploration; effects of exploration on society and on views of    the world.",,History,506
485,01:506:224,Slavery in World History (3),"Historical survey of the institution of slavery from   antiquity to the present day, with particular attention to the relationship   of human bondage to broader progress of social and economic change.",,History,506
486,01:506:241,Film and History (3),"Presentation of films relating to history and culture,   combined with readings and discussions of standard history accounts.",,History,506
487,01:506:251,History of Science and Society (3),"Science and its social context from 1500 to the   present. Development of ideas; interaction   with philosophy, religion, and art; science as a profession.",,History,506
488,01:506:253,History of Technology and Society (3),"Impact of new production, transportation,   communication, and consumer technologies on society from the industrial   revolution (mid-1700s) to the present.",,History,506
489,01:506:271,Jewish Society and Culture I: From   Antiquity to Middle Ages (3),"Social, economic, religious, and political experiences   of the Jewish people from the Biblical world of the ancient Near East until   the Middle Ages.",Credit not given for both this course and 01:563:201.,History,506
490,01:506:272,Jewish Society and Culture II: The   Modern Experience (3),Jewish life from the breakdown of traditional society   in Europe in the 1700s until the rise of the modern state of Israel in   the 20th century.,Credit not given for both this course and 01:563:202.,History,506
491,01:506:313,Women and Social Movements to 1945   (3),In-depth analysis of different ways women have   organized for change. Focus on three or four case studies using   cross-cultural perspectives to illustrate various themes of gender and   collective action by women.,Credit not given for both this course and 01:988:371.,History,506
492,01:506:314,Women and Social Movements since 1945   (3),"Twentieth-century autonomous women's movements,   emphasizing the second wave of feminism from cross-cultural perspectives. Selected case studies to illustrate themes of gender   and collective action.",Credit not given for both this course and 01:988:372.,History,506
493,01:506:321,Disease in History (3),"Human disease on a global scale from the Paleolithic   period to the present, with emphasis on infectious disease and diet.",,History,506
494,01:506:322,Black Death to Obesity Epidemic:   History of Public Health in the West (3),"Surveys attempts to protect health of human   populations from the Black Death in Europe to rising concern about   obesity in the United States. Explores shifting patterns of disease and   illness, and emergence and growth of public health as a domain of expert   knowledge and policy in the United States and Europe.",,History,506
495,01:506:324,History of AIDS Pandemic (3),"Explores the AIDS epidemic from a range of historical   vantage points: science, health care, and social and cultural life in a   variety of local, national, international, and institutional contexts.   Focuses on United States, Haiti, and Africa.",,History,506
496,01:506:328,Atlantic Cultures 1500-1800 (3),"Encounters between peoples of Europe, Africa, and the   Americas from the 16th through the 18th centuries. Team-taught,   interdisciplinary course with an emphasis on the interpretation  of   texts and visual images from the era.",Credit not given for both this course and 01:350:328.,History,506
497,01:506:361,History of Socialism and Communism   (3),"History of movements for socialism and communism,   their diverse development on the world scene and impact on modern history.",,History,506
498,01:506:363,Imperialism (3),"Causes of colonial expansion by European powers,   Russia, Japan, and the United States; the nature of colonial empires;   the impact of imperialism on Africa and Asia.",,History,506
499,01:506:364,Colonialism to Globalism (3),Differences and similarities of the major European   encounters with non-Europeans in modern history.,,History,506
500,01:506:373,History of Jewish Women (3),"Jewish women's history; examines the religious, social, intellectual,
and cultural environments of Jewish women from the biblical period
through the 20th century.",Credit not given for both this course and 01:563:373   or 01:988:373.,History,506
501,01:506:375,Jewish Immigrant Experience (3),"Modern Jewish immigrant experience, focusing on   European and Middle Eastern communities resettled in America, Israel,    and Europe.",Credit not given for both this course and 01:563:375.,History,506
502,"01:506:391,392","Historical Studies (3,3)",Separate sections focusing on different topics at   different times and in different areas. Specific titles available at time   of registration.,,History,506
503,01:506:393,Advanced Topics in the History of   Women (3),Advanced course on specialized topic in the history of   women.,Credit not given for both this course and 01:988:393.,History,506
504,"01:506:401,402","History Seminar (3,3)","Introduction to skills and techniques of historical   research, including writing a research paper based on primary sources.   Specific topics of sections available at time of registration.",,History,506
505,01:506:424,Reading and Writing about Nature (3),"Exploration of political, philosophical, fictional,   visual texts on relationship between humans and nature in Anglo-North   America, late-16th century to present.",Prerequisite: Permission of instructor.,History,506
506,01:506:451,Public History Internship (3),"Professional, supervised work for historical society, site, archives,
museum, legislative office, or equivalent; 112 hours required. Faculty
coordinator evaluates student's paper/product and agency's assessment.",Open only to junior and senior history majors.,History,506
507,01:506:452,General History Internship (3),"Professional, supervised work for historical society, site, archives,
museum, legislative office, or equivalent; 112 hours required. Faculty
coordinator evaluates student's paper/product and agency's assessment.",Open only to junior and senior history majors.,History,506
508,"01:506:471,472","Research in History (3,3)",One term independent study projects.,Not open to honors candidates.,History,506
509,"01:506:473,474","Readings in History (3,3)",Independent readings under supervision of a member   of the department.,,History,506
510,01:506:495-496,"Honors Program in History (BA,BA)","Focus on writing of a major research paper working   with an individual professor. A seminar guides through stages of writing   using short papers as the vehicle for the exploration; outlines, rough   drafts, etc.",Both terms must be completed to receive degree credit.,History,506
511,,,,,Mathematics,640
512,01:640:011,Precalculus I Workshop (E2),Workshop to accompany 01:640:111.,Corequisite: 01:640:111.,Mathematics,640
513,01:640:012,Precalculus II Workshop (E2),Workshop to accompany 01:640:112.,Corequisite: 01:640:112.,Mathematics,640
514,01:640:025,Elementary Algebra (E3),"Operations with polynomials, rational and square root   expressions, exponents, solving linear and   quadratic equations, basic applications and   graphing.",,Mathematics,640
515,01:640:026,Intermediate Algebra (E3),"Absolute value equations and inequalities, radical   expressions, rational exponents, quadratic equations and inequalities,   introduction to functions, and topics in analytic geometry.",Prerequisite: 01:640:025 or appropriate performance on   the placement test in mathematics.,Mathematics,640
516,01:640:027,Elements of Algebra (E3),"Review of fundamentals of elementary and intermediate   algebra. Exponents, polynomials, solution of   linear and quadratic equations. Focus on   mathematical translation of verbal statements.",Prerequisites: Acceptable performance on placement   test and permission of department. Not for students preparing for   calculus.,Mathematics,640
517,01:640:103,Topics in Mathematics for the Liberal   Arts (3),"Topics emphasizing fundamental ideas of mathematics,   selected from set theory, mathematical logic, game theory, number theory,   algebra, and geometry.",An elementary course for liberal arts majors.   Prerequisite: 01:640:026 or 027 or appropriate performance on the placement   test in mathematics. May not be used as an elective for the math major or   minor.,Mathematics,640
518,01:640:104,Elementary Combinatorics and   Probability (3),"Introduction to the basic concepts of combinatorial   mathematics, probability, and statistics.",An elementary course for liberal arts majors.   Prerequisite: 01:640:026 or appropriate performance on the placement   test in mathematics. May not be used as an elective for the math major or   minor.,Mathematics,640
519,01:640:105,Introduction to Linear Mathematics   (3),"Systems of linear equations, matrices, linear algebra,   and linear programming.",An elementary course for liberal arts majors.   Prerequisite: 01:640:026 or appropriate performance on the placement   test in mathematics. May not be used as an elective for the math major   or minor.,Mathematics,640
520,01:640:111-112,"Precalculus I,II (2,2)","Math 111: Algebraic expressions, algebraic equations,   inequalities, functions, and graphing. Math 112: Exponential, logarithmic,   and trigonometric functions.","Prerequisite: 01:640:026 or appropriate performance on   the placement test in mathematics. Corequisites: 01:640:011 for 111; 01:640:  012 for 112. These two courses cover the same   material as 01:640:115, but at a slower pace. Students may not receive more than 4 normal credits for any   combination of 01:640:111-112  and 115.",Mathematics,640
521,01:640:115,Precalculus College Mathematics (4),"Algebraic expressions, algebraic equations,   inequalities, functions, graphing. Exponential, logarithmic, and   trigonometric functions.","Prerequisite: 01:640:026 or appropriate performance on   the placement test in mathematics. Students may not receive more than 4   normal credits for any combination of 01:640:111-112 and 115. Students   who feel unprepared for this course (who have not had math for several   years or whose mathematical background is weak) should consider taking   01:640:111-112, which covers the same material as 115 but at a slower pace   and begins with an extensive review of intermediate algebra.",Mathematics,640
522,01:640:131,Calculus I Practicum (1),Application of algorithms studied in 01:640:135 to   problems.,Corequisite: 01:640:135.,Mathematics,640
523,01:640:132,Calculus II Practicum (1),Application of algorithms studied in 01:640:136 to   problems.,Corequisite: 01:640:136.,Mathematics,640
